{
    "id": "BLACK_GARLIC_BBQ_SAUCE",
    "production_type": "IN_HOUSE",
    "ingredient_type": "sauce",
    "name": "Black Garlic BBQ Sauce",
    "ingredients": [
        [400, "gram", "KETCHUP"],
        [200, "gram", "CARAMELIZED_ONION"],
        [100, "gram", "CIDER_VINEGAR"],
        [100, "gram", "MIRIN"],
        [100, "gram", "TAMARI"],
        [100, "gram", "BLACK_GARLIC"],
        [100, "gram", "BROWN_SUGAR"],
        [10, "gram", "MAPLE_SYRUP"],
        [5, "gram", "PAPRIKA"],
        [5, "gram", "SEA_SALT"],
        [2.5, "gram", "BLACK_PEPPER"],
        [2.5, "gram", "GARLIC_POWDER"],
        [2.5, "teaspoon", "OREGANO"],
        [2.5, "gram", "GOCHUGARU"],
        [2.5, "gram", "ZAATAR"]
    ],
    "instructions": [
        "Put everything in Vitamix and blend",
        "Taste for salt and pepper",
        "Label, date, store in walk-in or freezer",
        "Can be kept in walk-in for 1 week"
    ],
    "equipment": [
        "Vitamix"
    ]
}
