{
    "id": "AJI_AMARILLO_SAUCE",
    "production_type": "IN_HOUSE",
    "ingredient_type": "sauce",
    "name": "Aji Amarillo Sauce",
    "ingredients": [
        [400, "gram", "AJI_AMARILLO_JAR"],
        [200, "gram", "LIME_JUICE"],
        [100, "gram", "KOMBU_DASHI"],
        [100, "gram", "SUSHI_VINEGAR"]
    ],
    "instructions": [
        "Mix everything together in a quart container",
        "Label, date, refrigerate"
    ],
    "equipment": []
}
