{
    "id": "CHEESE_DRESSING",
    "production_type": "IN_HOUSE",
    "ingredient_type": "dressing",
    "name": "Cheese Dressing",
    "ingredients": [
        [1350, "gram", "WHOLE_MILK"],
        [540, "gram", "MANCHEGO_CHEESE"],
        [250, "gram", "CANOLA_OIL"],
        [100, "gram", "HEAVY_CREAM"],
        [90, "gram", "RICE_FLOUR"],
        [10, "gram", "BLACK_PEPPER"],
        [8, "gram", "SALT"]
    ],
    "instructions": [
        "Into a pot, bring milk and cream together",
        "At low heat, warm but do not boil",
        "With the stick blender, mix all the ingredients together",
        "Store into quarts"
    ],
    "equipment": [
        "pot",
        "stick blender"
    ]
}
